{
 "schema_version": "1.0",
 "milestone": "phase_5_audit",
 "survey_completed_at": "2026-10-06T17:39:56Z",
 "review_plan_status": "passed",
 "review_plan_completed_at": "2026-10-06T18:04:35Z",
 "review_plan_verdict": "PASS_WITH_WARNINGS",
 "review_plan_attempts": 1,
 "issues_generated": [
  "t13",
  "t16",
  "t17",
  "t18",
  "t19",
  "t22",
  "t24",
  "t25",
  "t26",
  "t27",
  "t28",
  "t29",
  "t31"
 ],
 "survey_attempts": 0
}
